{
  "$schema": "./tokens.schema.json",
  "version": 1,
  "meta": {
    "figma": {
      "fileKey": "",
      "lastSyncedAt": null,
      "themeMap": {
        "dark": "Dark",
        "light": "Light"
      }
    }
  },
  "colors": {
    "CLR_PRIMARY": {
      "dark": "#4986FF",
      "light": "#3760EA"
    },
    "CLR_ON_PRIMARY": {
      "dark": "#FFFFFF",
      "light": "#FFFFFF"
    },
    "CLR_PRIMARY_CONTAINER": {
      "dark": "#11225D",
      "light": "#D5DDFB"
    },
    "CLR_ON_PRIMARY_CONTAINER": {
      "dark": "#D5DDFB",
      "light": "#11225D"
    },
    "CLR_SECONDARY": {
      "dark": "#191D2A",
      "light": "#5A6070"
    },
    "CLR_ON_SECONDARY": {
      "dark": "#D7DBE7",
      "light": "#FFFFFF"
    },
    "CLR_SECONDARY_CONTAINER": {
      "dark": "#485479",
      "light": "#E6EAF8"
    },
    "CLR_ON_SECONDARY_CONTAINER": {
      "dark": "#E6EAF8",
      "light": "#191D2A"
    },
    "CLR_ERROR": {
      "dark": "#E92E2B",
      "light": "#D32F2F"
    },
    "CLR_ON_ERROR": {
      "dark": "#FFFFFF",
      "light": "#FFFFFF"
    },
    "CLR_ERROR_CONTAINER": {
      "dark": "#5D1211",
      "light": "#FFDAD6"
    },
    "CLR_WARN_CONTAINER": {
      "dark": "#F19F3B",
      "light": "#FFE0B2"
    },
    "CLR_ON_ERROR_CONTAINER": {
      "dark": "#FFD4D3",
      "light": "#410002"
    },
    "CLR_WARNING": {
      "dark": "#F5A34A",
      "light": "#ED6C02"
    },
    "CLR_ON_WARNING": {
      "dark": "#FFFFFF",
      "light": "#FFFFFF"
    },
    "CLR_WARNING_CONTAINER": {
      "dark": "#5D3811",
      "light": "#FFE7CC"
    },
    "CLR_ON_WARNING_CONTAINER": {
      "dark": "#FFECD8",
      "light": "#3D2A00"
    },
    "CLR_SUCCESS": {
      "dark": "#0AC882",
      "light": "#2E7D32"
    },
    "CLR_ON_SUCCESS": {
      "dark": "#FFFFFF",
      "light": "#FFFFFF"
    },
    "CLR_SUCCESS_CONTAINER": {
      "dark": "#115D42",
      "light": "#C8F7DC"
    },
    "CLR_ON_SUCCESS_CONTAINER": {
      "dark": "#D4FFEF",
      "light": "#00513A"
    },
    "CLR_INFO": {
      "dark": "#34BAEF",
      "light": "#0288D1"
    },
    "CLR_ON_INFO": {
      "dark": "#FFFFFF",
      "light": "#FFFFFF"
    },
    "CLR_INFO_CONTAINER": {
      "dark": "#114B5D",
      "light": "#D2F5FF"
    },
    "CLR_ON_INFO_CONTAINER": {
      "dark": "#D2F5FF",
      "light": "#003544"
    },
    "CLR_SURFACE": {
      "dark": "#12151E",
      "light": "#F7F9FF"
    },
    "CLR_SURFACE_DIM": {
      "dark": "#1D1F29",
      "light": "#E6EAF8"
    },
    "CLR_SURFACE_BRIGHT": {
      "dark": "#313852",
      "light": "#FFFFFF"
    },
    "CLR_SURFACE_CONTAINER_LOWEST": {
      "dark": "#1D1F29",
      "light": "#FFFFFF"
    },
    "CLR_SURFACE_CONTAINER_LOW": {
      "dark": "#191D2A",
      "light": "#F7F9FF"
    },
    "CLR_SURFACE_CONTAINER": {
      "dark": "#252B3E",
      "light": "#EEF1F8"
    },
    "CLR_SURFACE_CONTAINER_HIGH": {
      "dark": "#313852",
      "light": "#E2E6EF"
    },
    "CLR_SURFACE_CONTAINER_HIGHEST": {
      "dark": "#3C4564",
      "light": "#D8DDE9"
    },
    "CLR_SURFACE_CONTAINER_1": {
      "dark": "#313852",
      "light": "#E2E6EF"
    },
    "CLR_SURFACE_DIS_CONTAINER_1": {
      "dark": "#3D3E4C",
      "light": "#CFD4DF"
    },
    "CLR_ON_SURFACE": {
      "dark": "#FFFFFF",
      "light": "#161616"
    },
    "CLR_ON_SURFACE_VARIANT_0": {
      "dark": "#F3F4F7",
      "light": "#161616"
    },
    "CLR_ON_SURFACE_VARIANT_1": {
      "dark": "#D7DBE7",
      "light": "#4A5060"
    },
    "CLR_ON_SURFACE_VARIANT_2": {
      "dark": "#B0B7D0",
      "light": "#6B7280"
    },
    "CLR_OUTLINE": {
      "dark": "#485479",
      "light": "#C0C1D0"
    },
    "CLR_OUTLINE_VARIANT": {
      "dark": "#313852",
      "light": "#D5D8E2"
    },
    "CLR_MAIN_BACKGROUND": {
      "dark": "#191D2A",
      "light": "#F7F9FF"
    },
    "CLR_PROGRESS_NORMAL_FILL": {
      "dark": "#6297FF",
      "light": "#3760EA"
    },
    "CLR_PROGRESS_WARN_FILL": {
      "dark": "#EE8A20",
      "light": "#ED6C02"
    },
    "CLR_PROGRESS_ERROR_FILL": {
      "dark": "#E92E2B",
      "light": "#D32F2F"
    },
    "CLR_GREATER_BUTTON": {
      "dark": "#578BEF",
      "light": "#3760EA"
    },
    "CLR_BUTTON_GRADU_START": {
      "dark": "#6297FF",
      "light": "#6297FF"
    },
    "CLR_BUTTON_GRADU_END": {
      "dark": "#3360B7",
      "light": "#3360B7"
    },
    "CLR_GRADU": {
      "dark": "#B0B7D0",
      "light": "#C0C1D0"
    },
    "CLR_WIDGET_BUTTON_BLUE": {
      "dark": "#4986FF",
      "light": "#3760EA"
    },
    "CLR_WIDGET_BUTTON_BLUE_DIS": {
      "dark": "#3A67C0",
      "light": "#2448B8"
    },
    "CLR_WIDGET_BUTTON_GRAY_DIS": {
      "dark": "#3A4462",
      "light": "#B8BFCC"
    },
    "CLR_INDICATOR_SELECTED": {
      "dark": "#FFFFFF",
      "light": "#161616"
    },
    "CLR_INDICATOR_UNSELECTED": {
      "dark": "#ABB6C3",
      "light": "#ABB6C3"
    },
    "CLR_DIALOG_BG_COLOR": {
      "dark": "#000000"
    },
    "CLR_DIALOG_BG_MASK": {
      "dark": "#1A1D22"
    },
    "CLR_CHECKBOX_CONTAINER": {
      "dark": "#647384",
      "light": "#647384"
    },
    "CLR_CHECKBOX_SELECTED": {
      "dark": "#34BAEF",
      "light": "#3760EA"
    },
    "CLR_TEXT_PRIMARY_BLACK": {
      "dark": "#161616",
      "light": "#161616"
    },
    "CLR_PRIMARY_BRIGHT": {
      "dark": "#FFFFFF",
      "light": "#FFFFFF"
    },
    "CLR_BACKGROUND": {
      "dark": "#3B424D",
      "light": "#E7EBF2"
    },
    "CLR_PRIMARY_BLACK": {
      "dark": "#161616",
      "light": "#161616"
    },
    "CLR_BUTTON_BG_BLACK2": {
      "dark": "#DDDEE2",
      "light": "#DDDEE2"
    },
    "CLR_PRIMARY_BLUE": {
      "dark": "#3760EA",
      "light": "#3760EA"
    },
    "CLR_PRIMARY_DARK_BLUE": {
      "dark": "#0025AC",
      "light": "#0025AC"
    },
    "CLR_PRIMARY_BTN_BORDER": {
      "dark": "#C0C1D0",
      "light": "#C0C1D0"
    },
    "CLR_PRIMARY_DARK_BG": {
      "dark": "#2C3138",
      "light": "#E2E6EF"
    },
    "CLR_PRIMARY_BLACK_HOVER": {
      "dark": "#BCC3CC",
      "light": "#C9CFDA"
    },
    "CLR_PRIMARY_DIS_BG": {
      "dark": "#6B7580",
      "light": "#B0B7C3"
    },
    "CLR_PRIMARY_DIS_TEXT": {
      "dark": "#EDEFF2",
      "light": "#6B7280"
    },
    "CLR_PRIMARY_DIS_TEXT_PRESS": {
      "dark": "#2C3138",
      "light": "#D8DDE9"
    },
    "CLR_SECONDARY_DANGER_MASTER": {
      "dark": "#E55353",
      "light": "#D32F2F"
    },
    "CLR_WARNING_DARK": {
      "dark": "#CA2525",
      "light": "#D32F2F"
    },
    "CLR_PRIMARY_BLUE_DIS_TEXT": {
      "dark": "#BAC8F8",
      "light": "#2448B8"
    },
    "CLR_PRIMARY_BLUE_DIS_BG": {
      "dark": "#F7F9FF",
      "light": "#F7F9FF"
    },
    "CLR_KEYBOARD_BG": {
      "dark": "#E1E5EA",
      "light": "#E1E5EA"
    },
    "CLR_BANNER_INFO_BG": {
      "dark": "#E3E8F8",
      "light": "#E3E8F8"
    },
    "CLR_BANNER_WARN_BG": {
      "dark": "#FCECD8",
      "light": "#FCECD8"
    },
    "CLR_BANNER_ERROR_BG": {
      "dark": "#E55353",
      "light": "#E55353"
    },
    "CLR_DASH_DOT": {
      "dark": "#4D536A",
      "light": "#9AA4B2"
    },
    "CLR_PRIMARY_ZERO": {
      "dark": "#10B88F",
      "light": "#10B88F"
    },
    "CLR_SURFACE_CANVAS": {
      "dark": "#444E5B",
      "light": "#E7EBF2"
    },
    "CLR_BUTTON_LIGHT_BLUE_BG": {
      "dark": "#F7F9FF",
      "light": "#F7F9FF"
    },
    "CLR_BUTTON_LIGHT_BLUE_PRESSED": {
      "dark": "#EAEFFF",
      "light": "#EAEFFF"
    },
    "CLR_BUTTON_RED_PRESSED": {
      "dark": "#661616",
      "light": "#9A1F1F"
    },
    "CLR_BUTTON_DARK_PRESSED": {
      "dark": "#161616",
      "light": "#C9CFDA"
    },
    "CLR_BUTTON_DARK_DISABLED": {
      "dark": "#BCC3CC",
      "light": "#A6ADB8"
    },
    "CLR_BUTTON_DARK_GRAY_BG": {
      "dark": "#485479",
      "light": "#D8DDE9"
    }
  },
  "dimensions": {
    "BTN_HEIGHT_64": 64,
    "BTN_WIDTH_242": 242,
    "BTN_WIDTH_296": 296,
    "BTN_WIDTH_396": 396,
    "PAGE_HEIGHT": 400,
    "RADIUS_10": 10,
    "RADIUS_12": 12,
    "RADIUS_16": 16,
    "RADIUS_28": 28,
    "RADIUS_8": 8,
    "TOP_BAR_HEIGHT": 80,
    "WIN_HEIGHT": 480,
    "WIN_WIDTH": 800
  },
  "opacity": {
    "MASK_OPA_70": 0.7
  }
}
